{
  "$id": "document.json",
  "$schema": "http://json-schema.org/draft-07/schema#",
  "title": "go-pdf document validation",
  "type": "object",
  "properties": {
    "$schema": {
      "type": "string"
    },
    "width": {
      "type": "integer"
    },
    "height": {
      "type": "integer"
    },
    "text_size": {
      "type": "integer"
    },
    "compress_level": {
      "type": "integer"
    },
    "inset": {
      "type": "object",
      "$ref": "definitions.json#/definitions/inset"
    },
    "password": {
      "type": "string"
    },
    "templates": {
      "type": "array",
      "items": {
        "$ref": "definitions.json#/definitions/element_template"
      }
    },
    "header": {
      "$ref": "definitions.json#/definitions/header"
    },
    "footer": {
      "$ref": "definitions.json#/definitions/footer"
    },
    "pages": {
      "type": "array",
      "items": {
        "$ref": "definitions.json#/definitions/page"
      }
    }
  },
  "additionalProperties": false
}