{
  "$schema": "../../json_schema/document.json",
  "width": 595,
  "height": 842,
  "compress_level": 9,
  "pages": [
    {
      "liner_layout": {
        "orientation": "horizontal",
        "elements": [
          {
            "type": "image",
            "attributes": {
              "path": "work/sample1.jpg"
            }
          }
        ]
      }
    }
  ]
}
