{
  "$schema": "../../json_schema/document.json",
  "width": 595,
  "height": 842,
  "templates": [
    {
      "type": "image",
      "id": "template-t1",
      "attributes": {
        "size": {
          "width": 100
        }
      }
    }
  ],
  "pages": [
    {
      "liner_layout": {
        "orientation": "horizontal",
        "elements": [
          {
            "type": "image",
            "template_id": "template-t1",
            "attributes": {
              "path": "work/sample1.jpg"
            }
          },
          {
            "type": "image",
            "template_id": "template-t1",
            "attributes": {
              "path": "work/sample2.jpg"
            }
          }
        ]
      }
    }
  ]
}
