{
  "width": 595,
  "height": 842,
  "header": {
    "size": {
      "width": 595,
      "height": 20
    },
    "liner_layout": {
      "orientation": "horizontal",
      "elements": [
        {
          "type": "text",
          "attributes": {
            "text": "GLOBAL HEADER",
            "size": {
              "width": 575,
              "height": 20
            },
            "border": {
              "width": 1,
              "color": {
                "r": 59,
                "g": 175,
                "b": 117
              }
            }
          }
        }
      ]
    }
  },
  "footer": {
    "size": {
      "width": 595,
      "height": 20
    },
    "liner_layout": {
      "orientation": "horizontal",
      "elements": [
        {
          "type": "text",
          "attributes": {
            "text": "GLOBAL FOOTER",
            "size": {
              "width": 575,
              "height": 20
            },
            "border": {
              "width": 1,
              "color": {
                "r": 59,
                "g": 175,
                "b": 117
              }
            }
          }
        }
      ]
    }
  },
  "pages": [
    {
      "page_header": {
        "size": {
          "width": 575,
          "height": 20
        },
        "liner_layout": {
          "orientation": "horizontal",
          "elements": [
            {
              "type": "text",
              "attributes": {
                "text": "PAGE HEADER",
                "size": {
                  "width": 575,
                  "height": 20
                },
                "border": {
                  "width": 1,
                  "color": {
                    "r": 175,
                    "g": 223,
                    "b": 228
                  }
                }
              }
            }
          ]
        }
      },
      "page_footer": {
        "size": {
          "width": 575,
          "height": 20
        },
        "liner_layout": {
          "orientation": "horizontal",
          "elements": [
            {
              "type": "text",
              "attributes": {
                "text": "PAGE FOOTER",
                "size": {
                  "width": 575,
                  "height": 20
                },
                "border": {
                  "width": 1,
                  "color": {
                    "r": 175,
                    "g": 223,
                    "b": 228
                  }
                }
              }
            }
          ]
        }
      },
      "liner_layout": {
        "orientation": "horizontal",
        "elements": [
          {
            "type": "text",
            "attributes": {
              "text": "PAGE1"
            }
          }
        ]
      }
    },
    {
      "liner_layout": {
        "orientation": "horizontal",
        "elements": [
          {
            "type": "text",
            "attributes": {
              "text": "PAGE2"
            }
          }
        ]
      }
    }
  ]
}
