{
  "width": 595,
  "height": 842,
  "password": "passw0rd",
  "pages": [
    {
      "liner_layout": {
        "orientation": "horizontal",
        "elements": [
          {
            "type": "text",
            "attributes": {
              "text": "PROTECTED"
            }
          }
        ]
      }
    }
  ]
}
