{
  "$schema": "../../json_schema/document.json",
  "width": 595,
  "height": 842,
  "text_size": 18,
  "pages": [
    {
      "liner_layout": {
        "orientation": "horizontal",
        "elements": [
          {
            "type": "text",
            "attributes": {
              "text": "TEXT1"
            }
          },
          {
            "type": "text",
            "attributes": {
              "text": "TEXT2"
            }
          },
          {
            "type": "text",
            "attributes": {
              "text": "TEXT3"
            }
          },
          {
            "type": "text",
            "attributes": {
              "text": "TEXT4"
            }
          },
          {
            "type": "text",
            "attributes": {
              "text": "TEXT5"
            }
          },
          {
            "type": "text",
            "attributes": {
              "text": "TEXT6"
            }
          },
          {
            "type": "text",
            "attributes": {
              "text": "TEXT7"
            }
          },
          {
            "type": "text",
            "attributes": {
              "text": "TEXT8"
            }
          },
          {
            "type": "text",
            "attributes": {
              "text": "TEXT9"
            }
          },
          {
            "type": "text",
            "attributes": {
              "text": "TEXT10"
            }
          },
          {
            "type": "text",
            "attributes": {
              "text": "TEXT11"
            }
          },
          {
            "type": "text",
            "attributes": {
              "text": "TEXT12"
            }
          },
          {
            "type": "text",
            "attributes": {
              "text": "TEXT13"
            }
          }
        ]
      }
    },
    {
      "liner_layout": {
        "orientation": "horizontal",
        "liner_layouts": [
          {
            "orientation": "horizontal",
            "elements": [
              {
                "type": "text",
                "attributes": {
                  "text": "TEXT1"
                }
              },
              {
                "type": "text",
                "attributes": {
                  "text": "TEXT2"
                }
              },
              {
                "type": "text",
                "attributes": {
                  "text": "TEXT3"
                }
              },
              {
                "type": "text",
                "attributes": {
                  "text": "TEXT4"
                }
              },
              {
                "type": "text",
                "attributes": {
                  "text": "TEXT5"
                }
              },
              {
                "type": "text",
                "attributes": {
                  "text": "TEXT6"
                }
              },
              {
                "type": "text",
                "attributes": {
                  "text": "TEXT7"
                }
              },
              {
                "type": "text",
                "attributes": {
                  "text": "TEXT8"
                }
              },
              {
                "type": "text",
                "attributes": {
                  "text": "TEXT9"
                }
              },
              {
                "type": "text",
                "attributes": {
                  "text": "TEXT10"
                }
              },
              {
                "type": "text",
                "attributes": {
                  "text": "TEXT11"
                }
              },
              {
                "type": "text",
                "attributes": {
                  "text": "TEXT12"
                }
              },
              {
                "type": "text",
                "attributes": {
                  "text": "TEXT13"
                }
              }
            ]
          }
        ]
      }
    }
  ]
}
